{
  "$schema": "https://raw.githubusercontent.com/liangboqiang/TjuaeHub/main/schemas/extension-manifest.v1.schema.json",
  "author": "TjuaeUI",
  "contributes": {
    "acpAdapters": [
      {
        "id": "droid",
        "name": "Droid",
        "icon": "resources/icon.svg",
        "description": "Factory Droid adapter",
        "connectionType": "stdio",
        "cliCommand": "droid",
        "defaultCliPath": "bunx droid",
        "authRequired": true,
        "supportsStreaming": false,
        "acpArgs": ["exec", "--output-format", "acp"]
      }
    ]
  },
  "description": "Integrates Factory Droid as an ACP adapter in TjuaeUI.",
  "displayName": "Droid",
  "engine": {
    "tjuae": "^1.0.0"
  },
  "lifecycle": {
    "onInstall": {
      "shell": {
        "cliCommand": "bun",
        "args": ["add", "-g", "--trust", "droid"]
      },
      "timeout": 60000
    }
  },
  "name": "tjuaeext-droid",
  "version": "1.0.0"
}
