{
  "$schema": "https://raw.githubusercontent.com/liangboqiang/TjuaeHub/main/schemas/extension-manifest.v1.schema.json",
  "author": "TjuaeUI",
  "contributes": {
    "acpAdapters": [
      {
        "id": "codebuddy",
        "name": "CodeBuddy",
        "icon": "resources/icon.svg",
        "description": "CodeBuddy adapter",
        "cliCommand": "codebuddy",
        "defaultCliPath": "bunx @tencent-ai/codebuddy-code",
        "acpArgs": ["--acp"],
        "skillsDirs": [".codebuddy/skills"]
      }
    ]
  },
  "description": "Integrates CodeBuddy as an ACP adapter in TjuaeUI.",
  "displayName": "CodeBuddy",
  "engine": {
    "tjuae": "^1.0.0"
  },
  "lifecycle": {
    "onInstall": {
      "shell": {
        "cliCommand": "bun",
        "args": ["run", "scripts/install.ts"]
      },
      "timeout": 30000
    }
  },
  "name": "tjuaeext-codebuddy",
  "version": "1.0.0"
}
