{
  "$schema": "https://raw.githubusercontent.com/liangboqiang/TjuaeHub/main/schemas/extension-manifest.v1.schema.json",
  "author": "Tjuae",
  "contributes": {
    "acpAdapters": [
      {
        "id": "kimi",
        "name": "Kimi Code",
        "icon": "resources/icon.svg",
        "description": "Kimi Code 适配器",
        "connectionType": "stdio",
        "cliCommand": "kimi",
        "authRequired": true,
        "supportsStreaming": false,
        "acpArgs": ["acp"]
      }
    ]
  },
  "description": "将 Kimi Code CLI 作为 ACP 适配器集成到 TjuaeUI。",
  "displayName": "Kimi Code",
  "engine": {
    "tjuae": "^1.0.0"
  },
  "lifecycle": {
    "onInstall": {
      "shell": {
        "cliCommand": "bun",
        "args": ["run", "scripts/install.ts"]
      },
      "timeout": 120000
    }
  },
  "name": "tjuaeext-kimi",
  "version": "1.0.0"
}
