{
  "$schema": "https://raw.githubusercontent.com/liangboqiang/TjuaeHub/main/schemas/extension-manifest.v1.schema.json",
  "author": "TjuaeUI",
  "contributes": {
    "acpAdapters": [
      {
        "id": "openclaw-gateway",
        "name": "OpenClaw",
        "icon": "resources/icon.svg",
        "description": "OpenClaw adapter",
        "connectionType": "stdio",
        "cliCommand": "openclaw",
        "defaultCliPath": "bunx openclaw",
        "authRequired": false,
        "supportsStreaming": true,
        "acpArgs": ["acp"]
      }
    ]
  },
  "description": "Integrates OpenClaw as an ACP adapter in TjuaeUI.",
  "displayName": "OpenClaw",
  "engine": {
    "tjuae": "^1.0.0"
  },
  "lifecycle": {
    "onInstall": {
      "shell": {
        "cliCommand": "bun",
        "args": ["add", "-g", "openclaw"]
      },
      "timeout": 30000
    }
  },
  "name": "tjuaeext-openclaw-gateway",
  "version": "1.0.0"
}
