{
  "$schema": "https://raw.githubusercontent.com/liangboqiang/TjuaeHub/main/schemas/extension-manifest.v1.schema.json",
  "author": "TjuaeUI",
  "contributes": {
    "acpAdapters": [
      {
        "id": "mistral-vibe",
        "name": "Mistral Vibe",
        "icon": "resources/icon.svg",
        "description": "Mistral Vibe adapter",
        "connectionType": "stdio",
        "cliCommand": "vibe-acp",
        "authRequired": true,
        "supportsStreaming": false
      }
    ]
  },
  "description": "Integrates Mistral Vibe as an ACP adapter in TjuaeUI.",
  "displayName": "Mistral Vibe",
  "engine": {
    "tjuae": "^1.0.0"
  },
  "lifecycle": {
    "onInstall": {
      "shell": {
        "cliCommand": "bun",
        "args": ["run", "scripts/install.ts"]
      },
      "timeout": 120000
    }
  },
  "name": "tjuaeext-mistral-vibe",
  "version": "1.0.0"
}
