{
  "$schema": "https://raw.githubusercontent.com/liangboqiang/TjuaeHub/main/schemas/extension-manifest.v1.schema.json",
  "author": "TjuaeUI",
  "contributes": {
    "acpAdapters": [
      {
        "id": "opencode",
        "name": "OpenCode",
        "icon": "resources/icon.svg",
        "description": "OpenCode adapter",
        "cliCommand": "opencode",
        "defaultCliPath": "bunx opencode-ai",
        "acpArgs": ["acp"]
      }
    ]
  },
  "description": "Integrates OpenCode as an ACP adapter in TjuaeUI.",
  "displayName": "OpenCode",
  "engine": {
    "tjuae": "^1.0.0"
  },
  "lifecycle": {
    "onInstall": {
      "shell": {
        "cliCommand": "bun",
        "args": ["run", "scripts/install.ts"]
      },
      "timeout": 60000
    }
  },
  "name": "tjuaeext-opencode",
  "version": "1.0.0"
}
