{
  "$schema": "https://raw.githubusercontent.com/liangboqiang/TjuaeHub/main/schemas/extension-manifest.v1.schema.json",
  "author": "TjuaeUI",
  "contributes": {
    "acpAdapters": [
      {
        "id": "goose",
        "name": "Goose",
        "icon": "resources/icon.svg",
        "description": "Goose adapter",
        "cliCommand": "goose",
        "acpArgs": ["acp"],
        "skillsDirs": [".goose/skills"]
      }
    ]
  },
  "description": "Integrates Goose as an ACP adapter in TjuaeUI.",
  "displayName": "Goose",
  "engine": {
    "tjuae": "^1.0.0"
  },
  "lifecycle": {
    "onInstall": {
      "shell": {
        "cliCommand": "bun",
        "args": ["run", "scripts/install.ts"]
      },
      "timeout": 120000
    }
  },
  "name": "tjuaeext-goose",
  "version": "1.0.0"
}
